{
  "id": "cfg-process-instance-migration-101",
  "topic": "configuring-processes",
  "subtopic": "process-instance-migration",
  "difficulty": "easy",
  "style": "recall",
  "camundaVersion": "8.8",
  "scenario": "Sigma SaaS is auditing which BPMN task types its 2400 instances of the Camunda 8.8 contract-renewal process may migrate between. The platform team needs the canonical list of task elements covered by the migration tool before approving the upcoming model rollout.",
  "question": "Which task elements are listed as supported by the Camunda 8.8 process instance migration tool?",
  "options": [
    {
      "id": "a",
      "text": "Service task, user task, receive task, send task, business rule task, and script task are each listed as supported task elements in the Camunda 8.8 migration tool support matrix."
    },
    {
      "id": "b",
      "text": "Service task, user task, receive task, and send task are listed as supported task elements, while business rule task and script task are explicitly excluded from the support matrix."
    },
    {
      "id": "c",
      "text": "Service task, user task, manual task, send task, business rule task, and script task are listed as supported, with receive task explicitly excluded from the migration support matrix."
    },
    {
      "id": "d",
      "text": "Service task, user task, receive task, send task, business rule task, script task, and manual task are all listed as supported task elements in the migration tool support matrix."
    }
  ],
  "correctOptionId": "a",
  "optionExplanations": {
    "a": {
      "text": "Correct. The supported BPMN elements section lists service task, user task, receive task, send task, business rule task, and script task as the supported task elements for migration in Camunda 8.8."
    },
    "b": {
      "text": "Incorrect. Business rule task and script task are included in the supported tasks list, not excluded; this answer misstates the support matrix for these two task types."
    },
    "c": {
      "text": "Incorrect. Manual task is not listed in the supported tasks for migration, and receive task is listed as supported, so this combination misrepresents the matrix."
    },
    "d": {
      "text": "Incorrect. Manual task is not listed among the supported task elements for migration; the supported set covers service, user, receive, send, business rule, and script tasks only."
    }
  },
  "explanation": "Camunda 8.8's migration tool lists service task, user task, receive task, send task, business rule task, and script task as the supported task elements in its support matrix.",
  "docs": [
    {
      "title": "Process instance migration",
      "url": "https://docs.camunda.io/docs/components/concepts/process-instance-migration/"
    }
  ]
}
