{
  "id": "dec-dmn-16",
  "topic": "decisions-business-rules",
  "subtopic": "business knowledge model",
  "difficulty": "medium",
  "style": "concept",
  "camundaVersion": "8.8",
  "scenario": "Aurora Bank reuses an interest formula across decisions in a Camunda 8.8 DRD that runs 3500 loan checks per day. A modeler designs the BKM literal expression to take the loan amount and the interest rate as parameters and wants to know what the BKM returns to the consuming decision.",
  "question": "What does a BKM literal expression return after the FEEL expression has been evaluated in Camunda 8.8?",
  "options": [
    { "id": "a", "text": "A single result whose name matches the BKM element name and which is available to consuming decisions" },
    { "id": "b", "text": "A list of results, one per parameter, where each entry is named after the corresponding parameter on the BKM" },
    { "id": "c", "text": "A map of results keyed by literal expression line number and available only inside the BKM literal expression" },
    { "id": "d", "text": "A single result named feel_result regardless of the BKM element name and the parameter configuration of the BKM" }
  ],
  "correctOptionId": "a",
  "optionExplanations": {
    "a": { "text": "Correct. The docs state that a BKM literal expression returns a single result whose name is the same as the BKM element name, which is how consuming decisions reference the computed value." },
    "b": { "text": "Incorrect. Parameters are inputs to the FEEL expression of the BKM; the docs describe a single return value, not one return per parameter." },
    "c": { "text": "Incorrect. The docs describe a single named result; there is no mention of a per-line-number map of results from a BKM literal expression." },
    "d": { "text": "Incorrect. The docs tie the result name to the BKM element name, not to a fixed feel_result identifier independent of the model." }
  },
  "explanation": "A BKM literal expression in Camunda 8.8 evaluates its FEEL expression and returns a single value whose name matches the BKM element name. That naming convention is what lets other decisions inside the same decision reference the result by name.",
  "docs": [
    { "title": "DMN", "url": "https://docs.camunda.io/docs/components/modeler/dmn/dmn/" }
  ]
}
