{
  "id": "mng-selections-operations-74",
  "topic": "managing-development",
  "subtopic": "Operate",
  "difficulty": "medium",
  "style": "scenario",
  "camundaVersion": "8.8",
  "scenario": "At Quanta Logistics, a downstream payments microservice was down for 2 hours and 1800 Camunda 8.8 order-fulfillment instances now share an identical incident. The payments service is healthy again, so an operator needs to clear the stuck instances in one gesture rather than clicking each row individually in Operate.",
  "question": "What Operate feature lets the operator retry these 1800 instances together in a single gesture?",
  "options": [
    {
      "id": "a",
      "text": "Create a selection by checking the boxes next to the affected process instances, then choose the retry operation to apply it to every instance in the selection at once"
    },
    {
      "id": "b",
      "text": "Run a SQL UPDATE statement against the broker database to mark the affected instances as resolved, then the engine retries them on the next scheduler tick"
    },
    {
      "id": "c",
      "text": "Click retry on the topmost incident in the list; Operate then walks the rest of the list automatically and retries each instance one by one in order"
    },
    {
      "id": "d",
      "text": "Open Tasklist, filter by the affected process definition, and click the bulk retry button at the top of the Tasklist queue to retry all matching instances"
    }
  ],
  "correctOptionId": "a",
  "optionExplanations": {
    "a": {
      "text": "Correct. Operate supports a selection: the operator checks the boxes next to the process instances to include, picks the retry operation, confirms it, and the operation runs against every instance in the selection at once."
    },
    "b": {
      "text": "Incorrect. Camunda 8 instance state lives in the broker, not in a database operators are expected to mutate; Operate exposes selections and batch operations as the supported way to retry many instances."
    },
    "c": {
      "text": "Incorrect. Operate does not auto-walk an incident list after a single click; bulk retry requires building a selection by checking the boxes next to each instance the operator wants to include."
    },
    "d": {
      "text": "Incorrect. Tasklist is for user task work, not for retrying broker-level incidents; batch retries on process instances are performed from Operate using selections and operations."
    }
  },
  "explanation": "Operate's selection feature is built for exactly this scenario. The operator checks the boxes next to the affected process instances to form a selection, picks the retry operation, confirms it, and the engine then retries every instance in the selection.",
  "docs": [
    {
      "title": "Selections and operations",
      "url": "https://docs.camunda.io/docs/components/operate/userguide/selections-operations/"
    }
  ]
}
