{
  "id": "dec-decision-requirements-graph-41",
  "topic": "decisions-business-rules",
  "subtopic": "decision-requirements-graph",
  "difficulty": "easy",
  "style": "concept",
  "camundaVersion": "8.8",
  "scenario": "Atlas Retail evaluates 8000 orders per day through a Camunda 8.8 DRG used to pick promotions and shipping options. A junior modeler is adding a new node and is unsure which two forms of decision logic a single DMN decision element may directly contain.",
  "question": "Which two forms of decision logic may a single DMN decision element directly contain inside a DRG?",
  "options": [
    {
      "id": "a",
      "text": "A decision element directly contains either a BPMN call activity or a FEEL function library as its decision logic in the DRG"
    },
    {
      "id": "b",
      "text": "A decision element directly contains either a decision table or an embedded Java method body as its decision logic in the DRG"
    },
    {
      "id": "c",
      "text": "A decision element directly contains either a decision table or a decision literal expression as its decision logic in the DRG"
    },
    {
      "id": "d",
      "text": "A decision element directly contains either a decision literal expression or a knowledge source as its decision logic in the DRG"
    }
  ],
  "correctOptionId": "c",
  "optionExplanations": {
    "a": {
      "text": "Incorrect. A BPMN call activity belongs to a process model and a FEEL function library is not a decision-logic container; neither lives directly inside a DMN decision element."
    },
    "b": {
      "text": "Incorrect. Camunda DMN does not allow embedded Java code as the decision logic of a decision element; decision logic must be defined in DMN, not in a host language."
    },
    "c": {
      "text": "Correct. The docs state that the decision logic inside the decision must be either a decision table or a decision literal expression, which are the two supported forms."
    },
    "d": {
      "text": "Incorrect. A knowledge source is a separate DRG element representing an authority for a decision; it never serves as the decision logic of a decision element."
    }
  },
  "explanation": "Each decision node in a DRG holds its logic in exactly one of two supported containers: a decision table or a decision literal expression. Knowledge sources and other DRG elements describe context around the decision but never substitute for its decision logic.",
  "docs": [
    {
      "title": "Decision requirements graph",
      "url": "https://docs.camunda.io/docs/components/modeler/dmn/decision-requirements-graph/"
    }
  ]
}
